{
  "schema_version": 1,
  "family": "doctor",
  "profiles": {"default":"present","flywheel":"present","legacy":"present","combined":"present"},
  "legacy_symbols": [
    "doctorCmd", "doctorExitError", "doctorJSON", "doctorFix", "doctorDryRun",
    "doctorOnly", "doctorSkip", "doctorSince", "doctorOnline", "doctorQuick",
    "doctorSeverity", "doctorRobot", "doctorRobotTriage", "doctorExplainFlag",
    "doctorUndoStrict", "doctorGCBefore", "doctorGCYes", "registerDoctorSurface",
    "runDoctor", "runDoctorEngineDefault", "runDoctorFix", "runDoctorExplain"
  ],
  "live_owner": "cli/internal/commands/doctor",
  "allowed_paths": [
    "cli/cmd/ao/doctor*.go", "cli/cmd/ao/root.go", "cli/cmd/ao/validate.go",
    "cli/cmd/ao/cobra_commands_test.go", "cli/cmd/ao/testutil_test.go", "cli/cmd/ao/json_validity_test.go",
    "cli/cmd/ao/quality_test_support_test.go",
    "cli/cmd/ao/quickstart_verdict_test.go", "cli/internal/doctor/**",
    "cli/internal/adapters/doctor/**", "cli/internal/reviewerhealth/**",
    "cli/internal/adapters/reviewerhealth/**", "cli/internal/commands/doctor/**",
    "cli/internal/quality/**", "cli/docs/COMMANDS.md",
    "cli/testdata/compatibility-baseline/families/doctor/lineage.json"
  ]
}
