{
  "schema_version": 1,
  "family": "session",
  "profiles": {
    "default": "present",
    "flywheel": "present",
    "legacy": "present",
    "combined": "present"
  },
  "legacy_symbols": [
    "pickLatestHandoff",
    "rehydrateCmd",
    "rehydrateJSON",
    "renderRehydrateBrief",
    "runRehydrate",
    "runSessionBootstrap",
    "sessionBootstrapCmd",
    "sessionBootstrapJSON",
    "sessionBootstrapStatus",
    "sessionCmd"
  ],
  "live_owner": "cli/internal/commands/session",
  "allowed_paths": [
    "cli/cmd/ao/session*.go",
    "cli/cmd/ao/rehydrate*.go",
    "cli/cmd/ao/handoff.go",
    "cli/internal/commands/session/**",
    "cli/internal/sessionapp/**",
    "cli/testdata/compatibility-baseline/families/session/**"
  ]
}
