{
  "schema_version": 1,
  "family": "goals",
  "profiles": {
    "default": "present",
    "flywheel": "present",
    "legacy": "present",
    "combined": "present"
  },
  "legacy_symbols": [
    "goalsCmd",
    "defaultGoalsTimeoutSeconds",
    "goalsFile",
    "goalsTimeout",
    "goalsJSONOutput",
    "resolveGoalsFile",
    "goalsAddWeight",
    "goalsAddType",
    "goalsAddDescription",
    "goalsAddCmd",
    "goalsDriftCmd",
    "goalsExportCmd",
    "goalsHistoryGoalID",
    "goalsHistorySince",
    "goalsHistoryCmd",
    "goalsInitNonInteractive",
    "goalsInitTemplate",
    "goalTemplate",
    "goalTemplateGate",
    "validTemplateNames",
    "goalsInitCmd",
    "buildDefaultGoalFile",
    "buildInteractiveGoalFile",
    "detectGates",
    "autoDetectTemplate",
    "loadTemplate",
    "templateGatesToGoals",
    "goalsMeasureGoalID",
    "goalsMeasureDirectives",
    "goalsMeasureExcludeTag",
    "goalsMeasureTotalTimeout",
    "goalsMeasureScenariosOnly",
    "goalsMeasureCmd",
    "runMeasureWithScenarios",
    "runMeasureJSONWithScenarios",
    "runMeasureHumanWithScenarios",
    "directiveScenarioReport",
    "measureScenarioJSON",
    "measureModeFull",
    "measureModeScenariosOnly",
    "evaluateDirectiveScenarios",
    "buildDirectiveScenarioReport",
    "runScenariosOnly",
    "emitMeasureScenarioJSON",
    "renderScenarioReports",
    "recordVerdictLedgerIterations",
    "measureProjectRoot",
    "goalsMetaCmd",
    "migrateToMD",
    "directivesFromPillars",
    "pruneResult",
    "staleGoal",
    "goalsPruneCmd",
    "findMissingPath",
    "goalsRenderOut",
    "goalsRenderCmd",
    "renderScenario",
    "runGoalsRender",
    "goalsRenderProjectRoot",
    "renderDirectivesGherkin",
    "renderDirectiveFeature",
    "renderScenarioBlock",
    "renderScenarioSteps",
    "hasStructuredSteps",
    "writeStepGroup",
    "resolveRenderScenario",
    "readRenderScenario",
    "scenariosDirective",
    "scenariosDirectiveID",
    "scenariosCreate",
    "scenariosThreshold",
    "scenariosStatus",
    "scenariosSource",
    "scenariosLint",
    "scenariosStrict",
    "goalsScenariosCmd",
    "runGoalsScenarios",
    "validSteers",
    "goalsSteerCmd",
    "steerAddDescription",
    "steerAddSteer",
    "goalsSteerAddCmd",
    "goalsSteerRemoveCmd",
    "goalsSteerPrioritizeCmd",
    "loadMDGoals",
    "writeMDGoals",
    "steerAutoYes",
    "steerAutoAuto",
    "steerPreConfirmed",
    "steerAutoPolicyPath",
    "goalsSteerRecommendCmd",
    "goalsSteerApplyCmd",
    "steerEvalContext",
    "loadSteerContext",
    "runSteerRecommend",
    "runSteerApply",
    "guardAutoApply",
    "confirmApply",
    "applySteerRecommendation",
    "recordSteerCooldown",
    "printSteerRecommendations",
    "steerJSONOut",
    "emitSteerJSON",
    "steerProjectRoot",
    "steerPolicyPath",
    "traceFrom",
    "traceOrphans",
    "traceStrict",
    "goalsTraceCmd",
    "runGoalsTrace",
    "traceProjectRoot",
    "runTraceFrom",
    "rootedSubgraph",
    "expandReachable",
    "emitGraphJSON",
    "renderTree",
    "childIndex",
    "printChildren",
    "goalsTraceWriter",
    "treeGlyph",
    "edgeLabel",
    "nodeLine",
    "orphanFinding",
    "runTraceOrphans",
    "collectOrphans",
    "edgeDefectOrphans",
    "orphanDirectiveID",
    "orphanScenarioID",
    "orphanMessage",
    "missingYieldOrphans",
    "coverageIndex",
    "indexCoverage",
    "sortOrphans",
    "emitOrphansJSON",
    "renderOrphans",
    "orphanExit",
    "validateResult",
    "goalsValidateCmd",
    "outputValidateResult"
  ],
  "live_owner": "cli/internal/commands/goals",
  "allowed_paths": [
    "cli/cmd/ao/goals*.go",
    "cli/cmd/ao/eval_composition.go",
    "cli/cmd/ao/eval_composition_test.go",
    "cli/cmd/ao/seed.go",
    "cli/cmd/ao/seed_test.go",
    "cli/cmd/ao/cobra_commands_test.go",
    "cli/cmd/ao/completion_values_test.go",
    "cli/cmd/ao/json_validity_test.go",
    "cli/cmd/ao/negative_path_test.go",
    "cli/cmd/ao/testutil_test.go",
    "cli/internal/commands/goals/**",
    "cli/internal/adapters/goals/**",
    "cli/internal/goalsapp/**",
    "cli/docs/COMMANDS.md",
    "cli/testdata/compatibility-baseline/families/goals/**"
  ]
}
