{
  "schema_version": 1,
  "family": "eval",
  "profiles": {"default":"present","flywheel":"present","legacy":"present","combined":"present"},
  "legacy_symbols": [
    "evalCmd", "evalRunCmd", "evalCompareCmd", "evalBaselineCmd", "evalBaselineAuditCmd",
    "evalScorecardCmd", "evalCoverageCmd", "evalConfigured", "registerEvalCommand", "configureEvalCommand",
    "evalRunOutput", "evalRunID", "evalRunRuntime", "evalRunBaseline", "evalRunBaselineMode",
    "evalRunContextMode", "evalRunContextOffDir", "evalRunContextOnDir", "evalRunDeltaOut",
    "evalCompareOutput", "evalCompareMaxAgg", "evalCompareMaxDim", "evalScorecardOutput",
    "evalScorecardKind", "evalScorecardMaxCat", "evalBaselineOutput", "evalBaselineBy",
    "evalBaselineReason", "evalBaselineAuditRoot", "evalBaselineAuditDir", "evalCoverageRoot",
    "evalCoverageDomains", "evalCoverageEvidence", "evalCoverageDims", "evalCoverageRuntimes",
    "evalTaskCmd", "evalTaskAddCmd", "evalTaskListCmd", "evalTaskShowCmd", "evalTaskRunCmd",
    "runEvalTaskRun", "registerEvalTaskCmd",
    "evalCleanupCmd", "runEvalCleanup", "registerEvalCleanupCmd", "evalCleanupDelete",
    "evalCleanupTmpFiles", "evalCleanupAge", "evalCleanupDryRun",
    "evalSuiteCmd", "evalSuiteVerdictCmd", "evalSuiteNRequiredCmd", "runEvalSuiteVerdict",
    "runEvalSuiteNRequired", "registerEvalSuiteCmd",
    "evalOutcomesCmd", "evalOutcomesCompileCmd", "runEvalOutcomesCompile",
    "evalOutcomesIngestCmd", "runEvalOutcomesIngest", "evalOutcomesIngestExpectHash",
    "evalOutcomesIngestBurnLedger", "evalOutcomesIngestManifestOut", "evalOutcomesIngestRunID",
    "scenarioCmd", "scenarioInitCmd", "scenarioListCmd", "scenarioAddCmd", "scenarioValidateCmd",
    "scenarioEvaluateCmd", "runScenarioAdd", "runScenarioEvaluate", "scenarioListStatus",
    "evalScenarioABCmd", "evalScenarioMoatCmd", "evalSessionOutcomeCmd", "evalChaosCmd", "evalBenchCmd",
    "evalScenarioABScenario", "evalScenarioABOutput", "evalScenarioABBudget", "evalScenarioABTimeout",
    "evalScenarioABControlOnly", "evalScenarioMoatScorecards", "evalScenarioMoatOutput"
  ],
  "live_owner": "cli/internal/commands/eval",
  "allowed_paths": [
    "cli/cmd/ao/eval*.go",
    "cli/cmd/ao/scenario*.go",
    "cli/cmd/ao/retrieval_bench*.go",
    "cli/cmd/ao/root.go",
    "cli/cmd/ao/cobra_commands_test.go",
    "cli/cmd/ao/json_validity_test.go",
    "cli/cmd/ao/default_spine_test.go",
    "cli/internal/commands/eval/**",
    "cli/internal/adapters/eval/**",
    "cli/internal/eval/**",
    "cli/internal/evalsubstrate/**",
    "cli/internal/scenario/**",
    "cli/internal/scenarioresults/**",
    "cli/internal/bench/**",
    "cli/internal/verdict/**",
    "cli/internal/llm/**",
    "cli/docs/COMMANDS.md",
    "cli/testdata/compatibility-baseline/families/eval/**"
  ]
}
