{
  "schema_version": 1,
  "family": "version",
  "profiles": {
    "default": "present",
    "flywheel": "present",
    "legacy": "present",
    "combined": "present"
  },
  "legacy_symbols": [
    "currentVersionInfo",
    "runVersion",
    "versionCmd",
    "versionContract",
    "versionInfo"
  ],
  "live_owner": "cli/internal/commands/version",
  "allowed_paths": [
    "cli/cmd/ao/version*.go",
    "cli/internal/commands/version/**",
    "cli/testdata/compatibility-baseline/families/version/**"
  ]
}
