{
  "schema_version": 1,
  "family": "beads",
  "profiles": {
    "default": "present",
    "flywheel": "present",
    "legacy": "present",
    "combined": "present"
  },
  "legacy_symbols": [
    "beadsExitError",
    "execBD",
    "bdAvailable",
    "beadsCmd",
    "beadsDirCmd",
    "beadsTrackerCmd",
    "beadsVerifyCmd",
    "beadsLintCmd",
    "beadsHarvestCmd",
    "beadsAuditCmd",
    "beadsClusterCmd",
    "beadsExecCmd",
    "beadsResumeCmd",
    "beadsScenariosCmd",
    "beadsStaleCmd",
    "beadsEpicStatusCmd",
    "runBeadsDir",
    "runBeadsTrackerCmd",
    "runBeadsVerify",
    "runBeadsLint",
    "runBeadsHarvest",
    "runBeadsAudit",
    "runBeadsCluster",
    "runBeadsExec",
    "runBeadsResume",
    "runBeadsScenariosExtract",
    "runBeadsScenariosValidate",
    "runBeadsStale",
    "runBeadsEpicStatus",
    "runBeadsVerifyAcceptance",
    "newBeadsVerifyAcceptanceCmd"
  ],
  "live_owner": "cli/internal/commands/beads",
  "allowed_paths": [
    "cli/cmd/ao/beads*.go",
    "cli/cmd/ao/root.go",
    "cli/cmd/ao/root_test.go",
    "cli/internal/adapters/beads/**",
    "cli/internal/beads/**",
    "cli/internal/commands/beads/**",
    "cli/testdata/compatibility-baseline/families/beads/lineage.json"
  ]
}
