{
  "schema_version": 1,
  "family": "skills",
  "profiles": {
    "default": "present",
    "flywheel": "present",
    "legacy": "present",
    "combined": "present"
  },
  "legacy_symbols": [
    "capResults",
    "isDir",
    "joinArgs",
    "linkAllDests",
    "linkMissingSkills",
    "loadCatalogOrErr",
    "renderFindJSON",
    "renderFindText",
    "renderLinkResult",
    "renderNameList",
    "renderUnlinkResult",
    "resolveRepoSkillsDir",
    "resolveSkillsRoots",
    "resolveTargetDests",
    "runSkillsCheck",
    "runSkillsConsumers",
    "runSkillsFind",
    "runSkillsGraph",
    "runSkillsLink",
    "runSkillsList",
    "runSkillsProducers",
    "runSkillsResolve",
    "runSkillsUnlink",
    "runtimeConfigDirs",
    "skillLinkResult",
    "skillUnlinkResult",
    "skillsCheckCmd",
    "skillsCheckJSON",
    "skillsCheckOnly",
    "skillsCheckStrict",
    "skillsCmd",
    "skillsConsumersCmd",
    "skillsConsumersJSON",
    "skillsFindCmd",
    "skillsFindJSON",
    "skillsFindLimit",
    "skillsGraphCmd",
    "skillsGraphFormat",
    "skillsLinkCmd",
    "skillsLinkDest",
    "skillsLinkJSON",
    "skillsListCmd",
    "skillsListConsumes",
    "skillsListJSON",
    "skillsListPractice",
    "skillsListProduces",
    "skillsListRole",
    "skillsListUserInvocable",
    "skillsProducersCmd",
    "skillsProducersJSON",
    "skillsResolveCmd",
    "skillsResolveJSON",
    "skillsResolveStrict",
    "skillsUnlinkCmd",
    "skillsUnlinkDest",
    "skillsUnlinkJSON",
    "symlinkResolvesInto",
    "unlinkAllDests",
    "unlinkOwnedSkills"
  ],
  "live_owner": "cli/internal/commands/skills",
  "allowed_paths": [
    "cli/cmd/ao/skills*.go",
    "cli/internal/commands/skills/**",
    "cli/internal/skillsapp/**",
    "cli/testdata/compatibility-baseline/families/skills/**"
  ]
}
