{
  "schema_version": 1,
  "family": "flywheel",
  "profiles": {
    "default": "present",
    "flywheel": "present",
    "legacy": "present",
    "combined": "present"
  },
  "legacy_symbols": [
    "buildNamespaceComparison",
    "canonicalArtifactPath",
    "canonicalCitationType",
    "canonicalMetricNamespace",
    "canonicalSessionID",
    "canonicalSessionPattern",
    "citationConfidenceScore",
    "citationEventIsHighConfidence",
    "computeCitationPipeline",
    "computeHealthDelta",
    "computeMetricsForNamespace",
    "computeOperationalSigmaRho",
    "computeOverallVerdict",
    "computeResearchClosure",
    "computeReuseConcentration",
    "computeSigmaRho",
    "computeUtilityMetrics",
    "computeVelocityTrend",
    "countArtifacts",
    "countBypassCitations",
    "countLoopMetrics",
    "countNewArtifacts",
    "countNewArtifactsInDir",
    "countRetros",
    "countStaleArtifacts",
    "escapeVelocityThreshold",
    "filterCitationsByMetricNamespace",
    "filterCitationsForPeriod",
    "flywheelCmd",
    "flywheelCompareNamespace",
    "flywheelGolden",
    "flywheelStatusNamespace",
    "fprintGoldenSignals",
    "giniCoefficient",
    "highConfidenceCitationThreshold",
    "isRetrievableArtifactPath",
    "linearRegressionSlope",
    "metricsDays",
    "namespaceComparison",
    "normalizeArtifactPath",
    "normalizeCitationMatchConfidence",
    "periodCitationStats",
    "populateGoldenSignals",
    "primaryMetricNamespace",
    "printFlywheelStatus",
    "printNamespaceComparison",
    "retrievableCitationStats",
    "SectionFindings",
    "runFlywheelCompare",
    "runFlywheelStatus",
    "sessionIDAliases",
    "timestampSessionPattern",
    "utilityStats",
    "uuidSessionPattern"
  ],
  "live_owner": "cli/internal/commands/flywheel",
  "allowed_paths": [
    "cli/cmd/ao/flywheel*.go",
    "cli/cmd/ao/metrics_flywheel*.go",
    "cli/cmd/ao/metrics_golden*.go",
    "cli/cmd/ao/canonical_identity*.go",
    "cli/cmd/ao/citation_namespace*.go",
    "cli/cmd/ao/carveout_regression_test.go",
    "cli/internal/commands/flywheel/**",
    "cli/internal/flywheelapp/**",
    "cli/testdata/compatibility-baseline/families/flywheel/**"
  ]
}
